Abstract;Year
"An expert system for determining a sentance according to an embodiment of the present invention comprises: a first database for storing information about sentence factors corresponding to a crime type; a second database for storing a corresponding relationship between a legal provision and the sentence factors; a knowledge base for storing result data including an application method for at least one among a law a precedent or a supreme court examination standard determined by condition data expressed with a logical combination of the sentence factors and legal experts experience or knowledge; and a control unit for calculating a sentence from information about the sentence factors received from a user and a combination of the information stored in the first database the second database and the knowledge base. COPYRIGHT KIPO 2015";2015
The invention relates to the relevant technical field of patent information processing in particular to a technical competition and patent early warning analysis method based on knowledge discovery. The invention provides an intelligent patent analysis method based on the knowledge discovery and provides an analysis result with a high visual degree for a user. In brief an intellectual property database and an industrial field knowledge library are extracted and analyzed to establish a thematic database and form a corresponding dataset. On the basis data mining and knowledge discovery tools including a vector space a neural network mathematical statistics and the like are utilized to disclose deep information which is contained behind data and a visual statement is provided for users. Finally through patent early warning analysis patent theme strategy coordinate analysis and patent theme life cycle analysis technical competition and patent early warning are realized.;2017
The invention relates to a reinforcement learning based law cognition method and device and a medium and aims at improving the artificial intelligence (AR) level especially the AR level in the law field via machine reinforcement learning and law knowledge feedback by utilizing machine learning technologies in the field of AR. According to the method device and computer readable medium law knowledge atlas is called law concepts are obtained the confidence of the law concepts is evaluated a law cognition result is obtained an evaluation network of the law cognition results is established and the law knowledge atlas is back fed and reinforced via the evaluation network. An evaluation mechanism is introduced to law knowledge identification and processing and the law knowledge processing capability of AR is improved.;2018
"The invention discloses a product concept novelty evaluation method based on a knowledge base. The method can directly calculate a product concept novelty value according to a product concept and canprevent uncertainty brought by expert evaluation. The method comprises the following steps: extracting product concepts from existing products and converting the product concepts into a data expression form and storing the product concepts into a product concept knowledge base; analyzing the product concept knowledge base using a mathematical statistics method and determining key characteristicparameters of each product concept; determining novelty indexes as evaluation standard obtaining a value and weight of each novelty index by an expert evaluation method determining a novelty valueof a product concept; using the key characteristic parameters of product concept as input of an artificial neural network and the novelty value of the product concept as output of the artificial neural network training the artificial neural network to obtain an evaluation model of product concept novelty which is used to evaluate novelty of a product concept to be evaluated.";2018
"The invention relates to multi-level multi-dimension semantic comprehension of legal knowledge by use of a machine learning technology in the artificial intelligence field and belongs to the field ofartificial intelligence. According to a method a device and a computer readable medium legal text content is preprocessed to obtain legal text information; based on a similar word model a similar phrase model and a similar long sentence model a semantic concept aggregation is generated to construct a semantic comprehension module; legal properties and legal rules are generated based on a legalproperty extraction model to construct a legal rule module; and the semantic comprehension module and/or the legal rule construction module are/is used to recognize the legal text information and generate a legal knowledge map. In this way a natural language in a legal text is deeply comprehended and the processing capability of the legal knowledge by artificial intelligence is expanded.";2018
"The invention discloses a remote complaint system for procuratorate. The system includes a system box body wherein a host for mounting an inspector system is arranged in the system box body; the inspector system is provided with a plurality of access paths; wherein a plurality of man-machine interaction devices connected with an inspector system are mounted on the system box body; the inspector system comprises an autonomous learning unit; a natural language processing unit and a legal knowledge map unit the inspector system is connected with the remote inspection auxiliary system through anetwork; the remote complaint system of the inspection hospital is used for performing complaint work on parties in different areas and inspectors in different areas; the device is simple in structure high in practicability and easy to use and popularize communication communication and tools are provided great convenience is provided for complaints of parties and case handling of inspectors and therefore the case handling efficiency and quality are greatly improved.";2019
"The invention discloses a case-related property knowledge base entity recognition method based on ensemble learning. The method comprises: enabling a plurality of randomly selected case-related property related legal documents to be subjected to training set preprocessing according to entity categories; training the T learners according to the obtained training set to obtain learners; randomly selecting two case-related property related legal documents which are not in the test set and constructing a development set; performing classification accuracy calculation on corpora in the developmentset by using the trained learners and constructing weights of the learners by using the classification accuracy of each learner; enabling legal documents related to case-related properties to be subjected to word segmentation constructing a test set and classifying each learner samples in the test set; and combining the classification results of all learners and obtaining a final entity recognition result by adopting a weighted voting method. The method can solve the entity recognition problem of a small-scale corpus and high accuracy requirements and can automatically complete the related knowledge fusion of case-related property disposal according to the existing legal provisions.";2020
"The invention discloses a document semantic tag extraction method and device electronic equipment and a readable storage medium and relates to the field of knowledge maps natural language processing and deep learning. According to the specific implementation scheme the method comprises the steps of obtaining a target document of a to-be-extracted semantic tag; inputting the target document into a target extraction model obtaining a semantic tag of the target document; wherein the target extraction model is obtained by training an initial extraction model the initial extraction model is used for executing a semantic tag identification task and a role information identification task and a result of the semantic tag identification task and a result of the role information identification task are used for adjusting parameters of the initial extraction model; and outputting the semantic tag of the target document. According to the method the accuracy of the semantic tags can be high.";2020
"The embodiment of the invention provides an element obtaining method and device and relates to the field of knowledge maps and deep learning in the artificial intelligence technology. The method comprises the steps of: obtaining a source text; splitting the source text into a plurality of sub-paragraphs wherein each sub-paragraph comprises a session with complete semantics; respectively identifying elements in the plurality of sub-paragraphs; determining the states of the elements in the plurality of sub-paragraphs according to the time veins of the source text and recording the states of the elements as states with later time under the condition that the states of the elements are changed; and determining the element in the normal state as a target element. According to the time veinsof the source text and the sub-paragraphs of the session containing the complete semantics the states of the elements can be modified in real time and the accurate elements can be obtained.";2020
"The invention relates to the technical field of data processing and discloses a data processing method. Auxiliary court judgment is realized by constructing a legal knowledge graph of court trial cases wherein the knowledge graph is composed of various nodes and node relations and has the advantage of representing various complex relations naturally and the knowledge graph is a relation graph combining a knowledge method and human cognition is also a basis for realizing artificial intelligence and is an important method for a machine to understand natural language and construct a knowledge network; the invention further provides a data processing device and equipment and a computer readable storage medium the atlas is used for achieving auxiliary case judgment employees are greatlyhelped to rapidly retrieve related legal affair content online and therefore the quality and efficiency of court judgment work are improved.";2020
"The invention discloses a case recommendation method device and equipment and a storage medium and relates to the technical field of knowledge maps and deep learning. The specific implementation scheme is as follows: receiving a case recommendation request from terminal equipment wherein the case recommendation request is used for requesting to obtain a recommended case of a first case; obtaining a plurality of semantic elements of the first case wherein the semantic elements are elements for describing case composition; according to the similarity of the first case and the historical casefor each semantic element and the weight of each semantic element obtaining a recommended case of the first case from the historical case the weight of the semantic element being related to the type of the first case; sending recommended cases to a terminal device. The implementation scheme improves the accuracy of case recommendation.";2020
"The embodiment of the invention provides a content recommendation method and device and relates to the technical field of knowledge maps and deep learning and the method specifically comprises the steps: obtaining first data and second data; and inputting the first data and the second data into a preset first model to obtain a recommendation result wherein the first model is obtained by training based on the combination relationship of the set of the first type of data the set of the second type of data and the set of the third type of data and the set of the third type of data can be obtained by reasoning according to the set of the first type of data and the set of the second type of data the first data belongs to a first type of data the second data belongs to a second type of data the recommendation result belongs to a third type of data and the third type of data is data representing rules. The first model provided by the embodiment of the invention is different from a model obtained by utilizing text similarity or user behavior log training in the prior art and can be suitable for a law article recommendation scene.";2020
"The invention discloses a legal field event extraction method based on a pre-training model and a convolutional neural network algorithm and the method comprises the steps: crawling a public legal text corpus through a web crawler carrying out the text preprocessing of the original corpus and obtaining available legal text corpus data; obtaining high-frequency verbs and key nouns in the legal field and clustering the words; constructing an original legal event knowledge base IE and on this basis realizing large-scale automatic labeling of legal event corpus data in a remote supervised learning mode; and realizing a legal event extraction system based on an NEZHA pre-training corpus model and a DMCNN convolutional neural network model by using the obtained large-scale legal event prediction data. Large-scale automatic labeling of legal event corpus data is realized based on a remote supervised learning mode deep semantic information of legal text data is mined by utilizing the pre-training language model and the convolutional neural network algorithm and a better effect is achieved on a legal event extraction task.";2021
"The invention discloses a legal text-oriented knowledge representation learning method based on a TransE model. The method comprises the following steps: S1 acquiring a legal industry training text by using a mask language model; S2 according to the obtained legal industry training text dividing entities extracting a corresponding relation between the entities and storing defined data in a graph database in a triple form; and S3 matching industry word entities in a training text by utilizing the graph database and defining a target function of a knowledge representation learning TransE model. The model is trained by fusing the entity vector in the training text and the structure information in the graph database and the representation of the entity vector and the relationship vector is learned. According to the method the problem that only structured information is utilized and various kinds of extra information are not utilized in a traditional knowledge representation learning method is solved so that the knowledge representation obtained by fusing the text information can better represent a complex relationship in a knowledge base.";2021
"The invention discloses a method for constructing a knowledge graph based on criminal judicial documents and the method comprises the steps: carrying out the classification processing and summarization of various sentencing plots specified by legal specifications based on a server terminal building a structured semantic knowledge base forming a sentencing factor graph rule based on the sentencing factor graph rule automatically synchronizing data from a criminal judgment document network or manually adding document data to create a data set obtaining entity information through entity recognition information extraction knowledge fusion and knowledge storage constructing a knowledge graph collecting and learning and analyzing criminal judgment documents by adopting an artificial intelligence technical means continuously iterating and updating and perfecting the knowledge graph. According to the method sufficient legal basis is used as law support and the numerical accuracy is high; and different factors of criminal penalty amount are fully considered and the method can be suitable for different sentencing environments and can be continuously updated and perfected.";2021
"The invention discloses a textual entailment recognition method based on ensemble learning and expression integrated information and relates to the field of linguistic text processing. An existing Chinese textual entailment recognition system is mainly based on lexical features syntactic features a knowledge base artificially defined rules and the like however a model formed by training with lexical and syntactic information as independent features has low fitting degree for data and the rules and knowledge base have limited coverages. It is put forward that features of integrated lexical and syntactic information are added to train a classifier and that integrated learning skills are utilized so that textual entailment recognition accuracy is effectively improved. The method of the invention comprises the steps of preprocessing data; converting uniformity; extracting features; training by integrated learning; classifying voting decisions. The method is applicable to the recognition of inter-sentence entailment relations in various fields.";2017
"The application discloses a method a device and equipment for extracting information. One specific embodiment mode of the method for extracting the information comprises the following steps: acquiring an annotated corpus wherein the annotated corpus comprises a plurality of sample statements and annotated information sets corresponding to each of the sample statements; constructing an input sequence and an output sequence based on the sample statements and the annotated information sets corresponding to each of the sample statements in the annotated corpus; training an information extractingmodel for generating the output sequence from the input sequence by utilizing a deep learning method; inputting a statement to be processed into the information extracting model to extract out a knowledge information set contained in the statement to be processed wherein the annotated information sets comprises at least one type of the following knowledge which is extracted from the corresponding sample statement and standardized according to a preset rule: the knowledge based on verbs or prepositions the knowledge based on noun properties the description knowledge of entities and the knowledge of the relationship between entities and concepts. The implementation mode realizes effective and accurate extracting of information.";2018
"The invention provides a method for solving a reading comprehension question based on semantic analysis and SMT solution. The method comprises the following steps: firstly performing semantic parsingon the reading comprehension question to generate a first-order logic formula corresponding to the reading comprehension question then introducing four hypotheses namely a unique name hypothesisa closed world hypothesis a closure cause hypothesis and a unique answer hypothesis to generate a first-order logic formula corresponding to candidate answers; and finally verifying whether a knowledge base contains the first-order logic formula corresponding to the candidate answers by using a SMT solver and then figuring out the answer. Compared with the existing methods of expressing textsby using neural network models and word vectors the method provided by the invention has the advantages being able to better  establish the relationship between the events described in the reading comprehension question thereby giving a reading comprehension system a stronger expression ability and reasoning ability.";2018
A method apparatus and device are for extracting information. The method includes: acquiring an annotated corpus which includes a plurality of sample sentences and annotated information sets corresponding to the sample sentences constructing an input sequence and an output sequence based on the sample sentences and the annotated information sets corresponding to the sample sentences obtaining an information extraction model generating the output sequence from the input sequence by carrying out training with a deep learning method and inputting a to-be-processed sentence into the information extraction model to extract a knowledge information set included in the to-be-processed sentence. The annotated information set includes information of at least one piece of the following types of knowledge to be extracted from corresponding sample sentences: knowledge based on verbs or prepositions knowledge based on noun attributes knowledge of entity description and knowledge of a relationship between an entity and a concept.</p>;2019
System and method for method and system for event profiling is described that processes large volume of data gathered from a plurality of digital sources to automatically profile and continuously update an event. The system utilizes an ensemble of probabilistic classifiers for automated extraction of finer details of the event which use linguistic features for profiling information about the event wherein the information is spread across various data sources. Further disambiguation is performed to augment the accuracy of the event profiling. The system enables semantically linking of related events curated in the knowledge base and thereby performs semantic search over it. The system takes user-feedback and improves upon the information extraction process through reinforcement learning.</p>;2019
"The invention provides a time knowledge fuzzy measurement method and system based on weak supervised learning and the method comprises: customizing a narrative recognition rule based on weak supervised learning and generating a sample containing time knowledge; performing deep learning training on the neural network according to the samples containing the time knowledge; and obtaining time knowledge in sentences in the plot event through the neural network after deep learning training and calculating ambiguity of the time knowledge in the sentences in the plot event. According to the invention a weak supervision method is established time knowledge in narrative paragraphs can be recognized and extracted from a large text corpus calculation and sequential sorting of the time knowledgein the narrative paragraphs are achieved through the method space-time relation classification can be improved through the time knowledge and the performance in the aspect of narrative interactiveservice tasks is improved.";2020
"The invention discloses a causal relationship discrimination method and device electronic equipment and a storage medium and relates to the technical field of knowledge maps. The specific implementation scheme comprises the following steps of acquiring event words representing all events and associated words adjacent to all the event words from a target text; inputting the event words of each event and the associated words adjacent to each event into a graph neural network; and judging whether a causal relationship exists between any two events or not through the graph neural network. According to the embodiment of the invention whether the causal relationship exists between the events or not can be accurately judged the labor cost can be saved and the judgment efficiency is improved.";2020
A computer implemented method includes building a Positive Knowledge Base with directive words designated verbs and designated objects. A Negative Knowledge Base with designated phrases and designated legal terms is built. Tasks and phrases from the Positive Knowledge Base and the Negative Knowledge Base are built. Regulations are received. Phrases from the regulations are weighted against the Positive Knowledge Base and the Negative Knowledge Base to isolate positive Maintenance Compliances. The positive Maintenance Compliances are matched to tasks to derive ranked Maintenance Compliances. The ranked Maintenance Compliances are supplied.</p>;2020
Disclosed herein is an NLP system that is able to extract meaning from a natural language message using improved parsing techniques. Such an NLP system can be used in concert with an NLG system to interactively interpret messages and generate response messages in an interactive conversational stream. The parsing can include (1) named entity recognition that contextualizes the meanings of words in a message with reference to a knowledge base of named entities understood by the NLP and NLG systems (2) syntactically parsing the message to determine a grammatical hierarchy for the named entities within the message (3) reduction of recognized named entities into aggregations of named entities using the determined grammatical hierarchy and reduction rules to further clarify the message's meaning and (4) mapping the reduced aggregation of named entities to an intent or meaning wherein this intent/meaning can be used as control instructions for an NLG process.</p>;2020
"The invention discloses an event relationship generation method and device electronic equipment and a storage medium and relates to the technical field of knowledge maps natural language processingand deep learning. According to the specific implementation scheme the method comprises the steps: obtaining a first event statement and a second event statement generating a first granularity wordsequence vector and a second granularity word sequence vector according to the first event statement generating a third granularity word sequence vector and a fourth granularity word sequence vectoraccording to the second event statement; and generating a first fusion vector according to the first granularity word sequence vector and the second granularity word sequence vector generating a second fusion vector according to the third granularity word sequence vector and the fourth granularity word sequence vector and determining an event relationship between the first event and the secondevent according to the first fusion vector and the second fusion vector. The fusion vector of the event statement determined on the basis of the word sequence vectors with different granularities comprises the characteristics of the generalized event so that the accuracy and generalization of determining the event relationship between the events are improved.";2020
