Abstract;Year
"The invention discloses a threat intelligence generation method and device and the method comprises the steps: collecting description texts of various types of security events and collecting a vulnerability database and an attack utilization database; Filtering a first type of description text from the collected description text by using a regular expression to obtain a second type of description text the first type of description text not comprising a threat field and the second type of description text comprising a threat field; Classifying the second type of description text by using aconvolutional neural network to obtain a real threat information text and a false positive case threat information text; Extracting entities from the real threat information text extracting a relationship between the entities and generating triple information based on the relationship between the entities; And generating a threat intelligence knowledge map based on the triple information.";2019
"The invention discloses a campus safety internet of things perception platform which includes a self-service entry end a network communication terminal and a background server the self-service entry end is internally provided with a sensing platform the integrated sensing platform comprises an Internet of things device management module Communication protocol module virtual antenna sensing module application function module business linkage module virtual drill module knowledge base management module AI algorithm module big data display module and on-line patrol module are characterized in that: the self-service input terminal provides a user with a manual login platform and performs manual operation; The network communication end provides the communication of the self-serviceinput end and transmits the data to the background server end and the internet. By applying knowledge base artificial intelligence and software bus technology the invention improves the full self-detection level and the veracity of early warning of the campus safety internet of things and builds a highly sensitive situation sensing platform of the campus safety internet of things.";2019
"The invention discloses a data retrieval method and system based on knowledge representation learning. The method comprises the steps: arranging a retrieval information base; organizing the content inthe structured file document into a knowledge base form of the knowledge graph; generating all entity and relationship final vector representations and updating an entity vector document a relationship vector document and a parameter list document in the knowledge base file; and processing the to-be-retrieved content and performing retrieving in the knowledge base file to obtain sorted information and prediction information in the knowledge base. The system comprises a unified interaction interface an information processing module a knowledge graph representation learning module and an information retrieval module. The knowledge graph representation learning module comprises an entity relationship embedding unit a triple embedding unit and a knowledge graph prediction unit; extension of an original information base is achieved and the problem that in the prior art reasoning and prediction cannot be conducted on existing data in a database in the existing information retrievalprocess is solved.";2020
"The invention discloses a hidden association mining method based on representation learning. The method comprises the steps: crawling college teacher data to construct a knowledge base; vectorizing the entities through a DEEPWALK algorithm performing PCA principal component analysis to reduce the dimension of entity vectors to two dimensions and calculating the similarity between the entities through a distance measurement algorithm; vectorizing an entity by using an improved NODE2VEC algorithm calculating similarity after PCA dimension reduction and pushing an intersection of a recommendation list formed before dimension reduction and a recommendation list formed after dimension reduction to a user; segmenting the corpus input by the user through a reverse maximum matching algorithmmatching the corpus with the system self-defined dictionary constructing a Cypher query statement and returning the query entity data to the WEB application program. Relationship dimension extensionamong teacher entities is achieved by utilizing an association mining system. A user inputs a keyword query statement and calls an interface to obtain a teacher entity data set. The teacher entity attribute data and the inter-entity relationship data are rendered through ECharts to realize teacher entity visualization.";2020
"The invention discloses a spark machine learning system and method based on task visual dragging. The system comprises a process designer a process analyzer and a process scheduler. The method comprises the steps: dragging a data source assembly a data preprocessing assembly a machine learning assembly and a storage assembly to a design area to construct a machine learning process and generating a process description language; analyzing a machine learning flow chart constructed by a user analyzing the relationship input and output among the components and translating the flow chart intoa set of data which can be identified by a scheduler through a designed algorithm; and analyzing recognizable data and submitting the constructed machine learning process to a spark cluster for training.";2020
"The invention discloses a data relationship mining method and device based on a Mysql database log. The method comprises the following steps: obtaining and storing relational data of a Mysql database;acquiring and caching a data operation log according to the relational data; reading the data operation log and constructing a data knowledge network graph; establishing a data topic map according to the data knowledge network map; and displaying the data topic map and mining a data relationship. According to the invention the learning model is established in an artificial intelligence mode byanalyzing the operation log of the Mysql data and the data relationship is automatically analyzed and the data value is mined through the daily operation of the informatization system; the uncertainty caused by manual analysis is liberated to a certain extent and the resource cost is reduced. In addition the invention is non-inductive and transparent to business personnel; through automatic analysis of machine learning the relationship of data subjects can be clearly analyzed for business personnel and the business personnel can be helped to quickly construct a data knowledge graph.";2020
"The invention relates to a power distribution network energy-saving auxiliary decision-making system based on an expert system and the system comprises: a data obtaining module which is used for obtaining data needed by the energy-saving decision-making of a power distribution network through an ETL platform; the calculation and analysis module that is used for obtaining scores of the power distribution network energy-saving diagnosis indexes and judging index states according to standard thresholds of the power distribution network energy-saving diagnosis indexes and the index states comprise a health state a normal state and a warning state; the auxiliary decision-making module that is used for obtaining an inference conclusion that the index state is a warning state from a pre-constructed knowledge base through an inference engine verifying the inference conclusion and feeding back the inference conclusion to the user; according to the invention the expert system is used for the energy-saving auxiliary decision of the power distribution network thereby improving the data processing efficiency reducing the human errors of the decision and improving the safety of a power system.";2020
"The disclosure provides a search processing method and relates to the field of natural language processing. The method comprises the steps: acquiring a search statement; determining semantic relevancy between each of a plurality of documents stored in a knowledge base and the search statement; determining the surface text relevancy between each document and the search statement; determining an adjustment factor for each document based on the attribute information of each document; determining a comprehensive score of each document based on the semantic relevancy the surface text relevancy and the adjustment factor of the document; and moreover on the basis of the comprehensive scores of the plurality of documents selecting a predetermined number of documents from the plurality of documents as search results for the search statement. The disclosure further provides a search processing method and device computer equipment and a medium.";2020
The invention discloses a data processing method and device and electronic equipment and relates to the technical field of knowledge maps deep learning and big data. According to the specific implementation scheme during data retrieval hash calculation is performed on to-be-retrieved data according to the number of current fragments to determine a first fragment identifier corresponding to theto-be-retrieved data the first fragment identifier is searched for in the record and according to the search result the to-be-retrieved data is retrieved on a target fragment which is a first fragment corresponding to the first fragment identifier or a second fragment obtained by performing hash calculation on the to-be-retrieved data according to the number of initial fragments corresponding to a second fragment identifier. Compared with the prior art in which searching needs to be carried out in each fragment involved in the data the retrieval range is small although two times of hash calculation need to be carried out on the to-be-retrieved data computing resources occupied by the two times of hash calculation are few and therefore the retrieval efficiency of the data is improved to a certain degree.;2020
"The invention relates to an abnormal data flow online calibration system heurized by a brain-like hierarchical memory mechanism. The system comprises a missing data filling module (I) a dimension reduction module (II) a multi-dimensional counting Bloom filter module (III) a hierarchical memory library module (IV) an experience knowledge base module (V) and a calibrated data block module (VI).The I is used for filling up missing data in data blocks in a data stream batch processing link. The II is used for performing low-dimensional representation on the high-dimensional data in the data block. The III is used for judging whether the new data sample is abnormal . The IV is used for storing the historical data sample processed in the step II. The V is used for storing historical data samples which are processed by I but not processed by II. The III and theIV are matched with each other to be replaced and the IV and the V are matched with each other to be updated; and the VI is usedstoring the replaced and updated new data sample. According to the online calibration system under the condition that original data distribution is not changed outliers noise missing values and the self-adaptive concept drift phenomenon are corrected in real time.";2020
"The invention belongs to the field of grain storage and especially relates to a display method and device for warehousing information. Aiming at the problems that an existing method lacks a system intelligent decision module the knowledge base of the expert system only comes from national standards the difference with the actual situation is too large and the existing method only has effects on a specific granary and cannot be popularized and used the invention provides the following scheme: the display method of warehouse information comprises the following steps: S1 collecting environmental information of the warehouse granary collecting temperature humidity and pictures in the warehouse granary by using collection equipment and uploading the collected data to a computer processing system; and S2 collecting data information of the storage granary. The display method and device for warehousing information are reasonable in structure the display method has a systematic intelligent decision the difference between the display method and the actual situation is small different granaries can be displayed and ventilated blind ventilation is avoided resources are saved and the system can be used and popularized.";2020
"The invention discloses an artificial intelligence auditing quality control mode and system based on medical insurance disease type payment system ICD coding. The artificial intelligence auditing quality control mode comprises a data acquisition processing unit a knowledge base unit a rule base unit an early warning unit an artificial connotation quality control unit a cloud quality control unit an interaction unit and an analysis unit. The invention belongs to the technical field of medical insurance disease category payment and particularly relates to an ICD code artificial intelligence auditing quality control mode and system based on a medical insurance disease category payment system a big data mining technology is applied to form an ICD code related identification library from historical data and ICD code knowledge factors hidden in data resources and an association relationship thereof are obtained through extraction and conversion by applying a knowledge fusion technology; through a natural language processing technology a dynamic ICD coding table and a structured auditing logic discrimination database of each related knowledge base are established and the idea is that special medical record full quality control and other random spot check are dialectically combined; big data deep mining advanced artificial intelligence technology and coding experience are combined.";2021
"The embodiment of the invention provides an interactive intention knowledge network configuration method and system based on artificial intelligence wherein the method comprises the steps: obtaining a training sample set carrying out intention theme feature extraction of an interaction event verification flow sample and obtaining a sample interaction event feature of the interaction event verification flow sample; carrying out interactive intention path feature extraction on a mining information sample corresponding to the interaction event verification flow sample to obtain a sample interactive intention path feature of the mining information sample and calculating according to the target mining information and the mining information sample corresponding to the interaction event verification flow sample to obtain an intention topic difference; and calculating target difference according to the interactive intention path difference and the intention subject difference and adjusting parameters of the interactive intention knowledge network based on the target difference so as to generate diversified interactive intention representation mining information for the interactive event verification flow. The problem that in the prior art an interactive intention path of interactive intention representation mining information is single is effectively solved.";2021
"Systems computer program products and methods are described herein for implementing cognitive self-healing in knowledge based deep learning models. The present invention is configured to receive via the real-time resource transmission session one or more query strings from the user; transform the one or more query strings into one or more multi-dimensional query vectors; electronically retrieve one or more multi-dimensional resource vectors from a resource repository; determine a similarity index between the one or more multi-dimensional query vectors and one or more multi-dimensional resource vectors; determine a first multi-dimensional resource vector associated with at least one of the one or more multi-dimensional resource vectors; rasterize the first multi-dimensional resource vector into one or more grid of pixels to generate a first resource; and display via the real-time resource transmission session the first resource.</p>";2021
"The invention discloses a query information processing method and device based on artificial intelligence and belongs to the technical field of artificial intelligence information processing and the method comprises the following steps: S1 obtaining a query statement input by a user; S2 decomposing a query statement request of a user into a plurality of keywords for matching; S3 carrying out query matching on the keywords or synonyms of the keywords; and S4 according to a query matching result of the keyword or the synonym of the keyword determining at least one approximate query statement which is matched with the query statement and exists in a preset knowledge base. According to the query information processing method and device based on artificial intelligence information query is improved from a keyword-based level to a knowledge-based level by utilizing an artificial intelligence technology so that the method has certain understanding and processing capability on knowledge the query range is clarified and narrowed query of useless information is reduced and meanwhile the knowledge base is used as the background so that the information query is more intelligent.";2021
The invention discloses an equipment fault prediction method based on a self-learning convergence fault knowledge base and application thereof and aims to realize health evaluation of equipment partsand predict faults. Multi-dimensional state information of vibration displacement noise temperature current and the like of parts of the electromechanical equipment is recorded time domain and frequency domain characteristics of different health states (normal slight faults serious faults and the like) of the parts are extracted and a fault model base is established. The electromechanicalequipment fault sample set is trained based on the GABP neural network to obtain a mapping relationship between the state information of the key parts and the health states of the parts thereby achieving the functions of fault prediction and health management.;2021
"The invention discloses a heating control valve intelligent regulation and control system based on a convolution-self-coding neural network. The system comprises a data acquisition module a database module an intelligent decision module and an information control platform. The data acquisition module is used for acquiring the operation state data of a fluid flowing through a control valve in real time; the database module is used for receiving real-time state operation data and storing historical operation state data and a state recognition model is included in the intelligent decision module; the intelligent decision module is used for an expert knowledge base to select the most matched control decision scheme based on the recognition result of the current state of a heating system and uploads the control decision scheme to the information control platform; and the information control platform is used for displaying the current operation state and providing an intelligent decision result for the control staff for execution confirmation of the control decision so that the opening degree of a valve is intelligently remotely and accurately controlled in real time hysteresis is reduced and heating regulation balance is guaranteed.";2021
"The invention provides a multi-person cooperative visual data mining system. The multi-person cooperative visual data mining system comprises a front-end module and a rear-end module; the system also comprises a user authority management module a work space control module and a sharing mechanism control module and is used for enabling a plurality of users to cooperate through the work space enabling the users to share data with other cooperation partners in the work space in a one-key manner and enabling the users to share data modeling logic of the cooperation partners. Meanwhile the data and a prediction model can be persisted to an HDFS or data and modeling logic can be downloaded to a local file system. Nearly hundreds of data mining algorithms are built in the system and classic categories such as regression classification association rule analysis and deep learning are covered so that complete knowledge discovery and application processes of data exploration feature engineering model establishment model evaluation and model release are provided for users; the users can see through the commercial value contained in the data in a lightweight browser graphical interface by adopting a dragging operation mode without programming.";2021
"The invention discloses a method for constructing a knowledge graph based on criminal judicial documents and the method comprises the steps: carrying out the classification processing and summarization of various sentencing plots specified by legal specifications based on a server terminal building a structured semantic knowledge base forming a sentencing factor graph rule based on the sentencing factor graph rule automatically synchronizing data from a criminal judgment document network or manually adding document data to create a data set obtaining entity information through entity recognition information extraction knowledge fusion and knowledge storage constructing a knowledge graph collecting and learning and analyzing criminal judgment documents by adopting an artificial intelligence technical means continuously iterating and updating and perfecting the knowledge graph. According to the method sufficient legal basis is used as law support and the numerical accuracy is high; and different factors of criminal penalty amount are fully considered and the method can be suitable for different sentencing environments and can be continuously updated and perfected.";2021
"The invention discloses a numerical control machine tool fault monitoring and diagnosis system based on data mining. The system comprises a data management module a data interpretation module an intelligent fault diagnosis module a data mining module and a man-machine interaction module. The data management module supports real-time importing of current data and batch importing and exporting ofhistorical data; the data interpretation module performs preprocessing feature extraction and symptom extraction on the data; the intelligent fault diagnosis module is used for reasoning system-level faults by synthesizing the obtained symptoms and diagnosis knowledge; the data mining module autonomously mines an unknown fault mode alarm criterion and a diagnosis knowledge rule and updates an alarm criterion library and a diagnosis knowledge base; the man-machine interaction module realizes setting control of fault monitoring and diagnosis processes and real-time display of results; the system has the advantages that machine tool operation is fully utilized to naturally generate data deep modeling of a machine tool with a complex mechanism is not needed the knowledge bottleneck of a traditional expert system type diagnosis system is broken through the diagnosis process is automatic and diagnosis is rapid and accurate.";2021
The invention relates to the technical field of rehabilitation of artificial intelligence and Internet technology and discloses an autism spectrum disorder child rehabilitation nursing system based on artificial intelligence. The system comprises an intelligent safety monitoring terminal which is used for performing safety monitoring on rehabilitation training of a patient an intelligent accompanying terminal which is used for carrying out emotion accompanying and nursing guidance on the training items of the patient an intelligent rehabilitation training terminal which is used for performing rehabilitation training and evaluation on the patient and a cloud server which is used for providing a rehabilitation nursing knowledge base providing targeted schemes for differences of different patients and assisting the nursing process fed back by the terminal. The system is based on prior rehabilitation nursing knowledge of child autism spectrum disorder rehabilitation experts voice recognition intelligent dialogue and knowledge graph artificial intelligence technologies are combined and a patient and child rehabilitation nursing system integrating rehabilitation training guidance and emotion accompanying is built.;2021
Disclosed herein is a clinical decision support system for predicting a diagnosis of musculoskeletal pathologies in accordance with some embodiments. Accordingly the clinical decision support system may include a communication device a processing device and a storage device. Further the communication device may be configured for transmitting questions to a first device and receiving responses corresponding to the questions from the first device. Further the communication device may be configured for transmitting a prediction to a second device. Further the processing device may be communicatively coupled with the communication device. Further the processing device may be configured for analyzing the responses based on a knowledge repository and generating the prediction of a diagnosis of a musculoskeletal pathology using a machine learning model based on the analyzing. Further the storage device may be communicatively coupled with the processing device. Further the storage device may be configured for retrieving the knowledge repository.</p>;2021
