Abstract;Year
"According to the present invention a system for transfer and payment of knowledge contents to perform the transfer and payment of the knowledge contents desired by a user (40) on a knowledge sharing server platform (10) connected to a network environment (20) or a wireless environment (30) includes: a platform production tool (11) for producing all knowledge contents registered in the knowledge sharing server platform (10); a big data analysis system (12) for comprehensively analyzing usage traces of the user (40) for the system for the transfer and payment of the knowledge contents and providing feedback learning to the user (40); a provider matching system (13) for matching a provider (50) with the user (40) online or offline for learning of the knowledge contents; a provider designation system (14) for allowing the learning of the knowledge contents by allowing the user (40) to designate the provider (60); an artificial intelligence system (15) for providing anticipative feedback learning to the user (40) for problems expected upon the learning of the knowledge contents; and a payment system (16) using cyber money when transacting all tangible and intangible products distributed in the knowledge sharing server platform (10) wherein the knowledge contents desired by the user are transferred as the user (40) selects one of a plurality of learning devices and the payment system (16) performs a payment process between the user (40) and a head office (50) between the head office (50) and the provider (60) or between the user (40) and the head office (50) and the provider (60). COPYRIGHT KIPO 2020";2020
"The invention provides a learning engine open platform management system. The method comprises the following steps: preprocessing and analyzing multi-modal information on vision voice and touch of atarget user in a teaching interaction process; in this way the instruction interaction situation between the target user and the open platform in the teaching interaction process is determined thenthe learning engine model is optimized according to the instruction interaction situation images and/or sounds are played to conduct knowledge education interaction with the target user and therefore the teaching efficiency and teaching quality of the teaching platform are improved.";2020
"The invention discloses an online exercise personalized recommendation system based on a machine learning algorithm and the system comprises a question selection module which comprises an automatic question selection module and a manual question selection module the automatic question selection module employs an algorithm to automatically output a selected question set and the manual selected question is autonomously selected by a user; the online learning knowledge base comprises learning resources such as exercises test papers hearing materials and online lesson videos and the knowledge base comprises a learning resource feature extraction algorithm; learning a resource feature extraction algorithm: using a machine learning algorithm to obtain a hiding rule contained in the data set; and the recommendation engine is used for inferring knowledge mastering conditions and weak points of the user according to user behaviors by using a machine learning technology and matching learning resources suitable for the user from the knowledge base and the recommendation engine comprises a user portrait algorithm and a recommendation algorithm. According to the invention exercises can be recommended in a targeted manner for user knowledge weak points and pain points the time is efficiently utilized and the learning efficiency is improved.";2021
"The present specification relates to a method for tracking user knowledge of a system for tracking user knowledge comprising the steps of: inputting question information into a k^th encoder neural network and generating attention information by reflecting a weight on the question information; inputting response information into a k^th decoder neural network and generating query data which are information on a question to which a user intends to predict the probability of a correct answer by reflecting a weight on the response information; learning the system for tracking user knowledge using the attention information as a weight for the query data; and if the respective number of stacking a plurality of encoder neural networks and a plurality of decoder neural networks is N regenerating the attention information and re-learning the system for tracking user knowledge based on comparison between the N and the k wherein the system for tracking user knowledge may include the encoder neural networks and the decoder neural networks. Therefore an input data format optimized for tracking user knowledge is used to improve performance. COPYRIGHT KIPO 2022";2021
"The present invention relates to a method for tracking user knowledge with more improved accuracy. An operation method of a system for tracking user knowledge including a plurality of encoder neural networks and a plurality of decoder neural networks comprises the steps of: inputting question information to a k^th encoder neural network and inputting response information to a k^th decoder neural network; generating query data which is information on a question to predict a correct answer probability by a user by reflecting a weight to the response information and generating attention information to be used as a weight for the query data by reflecting the weight to the question information; and learning the system for tracking user knowledge using the attention information as a weight for the query data. COPYRIGHT KIPO 2021";2021
"The present specification relates to a method for tracking user knowledge of a system for tracking user knowledge. The method comprises the steps of: inputting question information into a k^th encoder neural network and generating attention information by reflecting a weight on the question information; inputting response information into a k^th decoder neural network and generating query data which is information on a question to which a user intends to predict a probability of a correct answer by reflecting a weight on the response information; learning the system for tracking user knowledge using the attention information as a weight for the query data; and regenerating the attention information based on comparison between N which is the number of stacking a plurality of encoder neural networks and a plurality of decoder neural networks and the k wherein the system for tracking user knowledge may include the encoder neural networks and the decoder neural networks. Therefore an input data format optimized for tracking user knowledge is used to improve performance. COPYRIGHT KIPO 2022";2021
"The present specification relates to a method for tracking user knowledge of a system for tracking user knowledge comprising the steps of: inputting question information which is composed of a plurality of questions expressed by vectors into a k^th encoder neural network and generating attention information by reflecting a weight on the question information; inputting response information which is composed of user responses to the respective questions into a k^th decoder neural network and generating query data which are information on a question to which a user intends to predict the probability of a correct answer by reflecting a weight on the response information; and learning the system for tracking user knowledge using the attention information as a weight for the query data wherein the system for tracking user knowledge may include a plurality of encoder neural networks and a plurality of decoder neural networks. Therefore an input data format optimized for tracking user knowledge is used to improve performance. COPYRIGHT KIPO 2022";2021
"The present specification relates to a method for tracking user knowledge of a system for tracking user knowledge comprising the steps of: inputting question information into a k^th encoder neural network and generating attention information by reflecting a weight on the question information wherein the question information includes identification information to identify a question the type information of the question and position information on where the question is placed among all the questions; inputting response information into a k^th decoder neural network and generating query data which are information on a question to which a user intends to predict the probability of a correct answer by reflecting a weight on the response information; and learning the system for tracking user knowledge using the attention information as a weight for the query data wherein the system for tracking user knowledge may include a plurality of encoder neural networks and a plurality of decoder neural networks. Therefore an input data format optimized for tracking user knowledge is used to improve performance. COPYRIGHT KIPO 2022";2021
"The present specification relates to a method for tracking user knowledge in a system for tracking the user knowledge which has improved performance using an input data format optimized for tracking the user knowledge. The method for tracking the user knowledge includes the steps of: inputting problem information into a k^th encoder neural network and generating attention information by reflecting a weight in the problem information; inputting response information into the k^th decoder neural network reflecting the weight in the response information to generate query data which is information on a problem for predicting the probability of a corrected answer by a user; and training the system for tracking the user knowledge using the attention information as the weight for the query data. The system for tracking the user knowledge includes a plurality of encoder neural networks and a plurality of decoder neural networks. The step of generating the attention information may include the step of performing upper triangular masking which is an operation for preventing information corresponding to a future position from being subject to an attention operation to predict a next problem. COPYRIGHT KIPO 2022";2021
"The present disclosure relates to a method for tracking user knowledge in a system for tracking the user knowledge capable of predicting a probability of correct answer of a user by inputting information on a problem into an encoder neural network having a transformer structure and inputting information on an answer into a decoder neural network. The method for tracking the user knowledge includes the steps of: generating attention information by inputting the information on the problem into a k^th encoder neural network and reflecting a weight in the information on the problem; generating query data which is information on a problem to be predicted in the probability of the correct answer of the user by inputting the information on the answer into the k^th decoder neural network and by reflecting the weight in the information on the answer; learning the system for tracking the user knowledge by using the attention information as the weight to the query data; and regenerating the attention information based on the comparison between N and K which are number for stacking a plurality of encoder neural networks and a plurality of decoder neural networks. The system for tracking the user knowledge may include the plurality of encoder neural networks and the plurality of decoder neural networks. COPYRIGHT KIPO 2022";2021
The present disclosure relates to a method for tracking user knowledge in a system for tracking the user knowledge capable of predicting a probability of a correct answer of a user by inputting information on a problem into an encoder neural network having a transformer structure and inputting information on an answer into a decoder neural network. Attention information is generated by inputting the information on the problem into a k^th encoder neural network and by reflecting a weight in the information on the problem. Query data which is information on a problem to be predicted in the probability of the correct answer of the user is generated by inputting the information on the answer into the k^th decoder neural network and by reflecting the weight in the information on the answer. The system for tracking the user knowledge is trained by using the attention information as the weight to the query data. Attention information is regenerated based on the comparison between N and K which are number for stacking a plurality of encoder neural networks and a plurality of decoder neural networks. The system for tracking the user knowledge is trained based on the regenerated attention information. The system for tracking the user knowledge may include the plurality of encoder neural networks and the plurality of decoder neural networks. COPYRIGHT KIPO 2022;2021
"The invention discloses an elementary education choice question answering method and device based on a multi-channel convolutional neural network. The method comprises the following steps of: 1) giving a choice question presented in a text form supplementing each option into assertions retrieving each assertion by utilizing a subject knowledge base and screening through a bridging rule to obtain high-confidence evidences; 2) processing the problem information and the high confidence evidence by using a multi-channel convolutional neural network to obtain a confidence competition result between options; and 3) judging an optimal option according to a confidence competition result among the options. High-confidence evidences can be retrieved from a subject knowledge base by utilizing a bridging attention mechanism then questions and evidences are processed simultaneously through a gated multi-channel convolutional neural network to obtain comparison scores among options and then theoptimal option is determined based on the accumulation scores of comparison among all option pairs. Therefore the machine can answer specific subject choice questions in the primary education stageand good performance is obtained.";2021
"The present disclosure relates to a method for tracking user knowledge in a system for tracking the user knowledge capable of predicting a probability of correct answer of a user by inputting information on a problem into an encoder neural network having a transformer structure and inputting information on an answer into a decoder neural network. The method for tracking the user knowledge may include the steps of: generating attention information by inputting the information on the problem into a k^th encoder neural network and reflecting a weight in the information on the problem; generating query data which is information on a problem to be predicted in the probability of the correct answer of the user by inputting the information on the answer into the k^th decoder neural network and by reflecting the weight in the information on the answer; and learning the system for tracking the user knowledge by using the attention information as the weight to the query data. The system for tracking the user knowledge includes a plurality of encoder neural networks and a plurality of decoder neural networks. The step of generating the attention information may include the steps of: performing a key-query masking operation which is an optional operation for preventing an attention from being performed with respect to a zero value (zero padding). COPYRIGHT KIPO 2022";2021
"The present invention relates to a knowledge content transfer and payment system for transferring desired knowledge content and settling a payment by a user (40) in a knowledge sharing server platform (10) connected to a network environment (20) or a wireless environment (30) which comprises: a platform production tool (11) for producing all knowledge contents registered in a knowledge sharing server platform (10); a big data analysis system (12) for comprehensively analyzing usage traces of a user (40) for a knowledge content transfer and payment system and providing the user (40) with feed-back learning; a provider matching system (13) for matching a provider (50) and the user (40) online or offline for learning the knowledge contents; a provider designation system (14) for learning the knowledge contents by designation of the provider (60) by the user (40); an artificial intelligence system (15) for providing the user (40) with preemptive feedback learning with respect to problems expected when learning the knowledge contents; and a payment system (16) using cyber money when transacting all tangible and intangible products distributed in the knowledge sharing server platform (10). The knowledge contents desired by the user are transferred by selection of the user (40) for one of a plurality of learning means and a payment process between the user (40) and a head office (50) between the head office (50) and the provider (60) or between the user (40) the head office (50) and the provider (60) is performed. COPYRIGHT KIPO 2022";2021
"The invention discloses an intelligent semantic matching method and device for educational consultation service and belongs to the technical field of artificial intelligence and natural language processing. In order to solve the technical problem of judging whether semantics of sentence pairs are consistent or not the technical scheme adopted by the invention is as follows: constructing and training a semantic matching model consisting of a multi-granularity embedding module a double-attention semantic matching module a feature aggregation module and a label prediction module; self-attention operation is carried out on word granularity of sentences to obtain key semantic feature representation mutual attention operation between the sentences is carried out to obtain semantic alignment feature representation of mutual perception of sentence pairs and encode the semantic alignment feature representation then similarity of the sentence pairs is measured the similarity is aggregated with the semantic alignment feature representation of perception context to judge whether the semantics of the sentence pairs are consistent or not. The device comprises a sentence pair semantic matching knowledge base construction unit a training data set generation unit a sentence pair semantic matching model construction unit and a sentence pair semantic matching model training unit.";2021
When a user photographs a mathematical problem in a knowledge sharing server platform connected to a network environment or a wireless environment with a smart device to register the mathematical problem in a platform server a formula is converted into text by a Mathpix API in the optical character recognition (OCR) technology and the language except for the formula is converted into text by using a Google API. The reason for this is because Mathpix has very high accuracy whereas Google or Naver OCR has low accuracy in formula recognition. Artificial intelligence is trained based on data obtained by the OCT technology to match a previously constructed unit and difficulty classification database to automatically classify the unit and difficulty of the corresponding problem to automatically store the corresponding classification and difficulty in the previously constructed database. COPYRIGHT KIPO 2022;2021
"The present invention relates to an AI-based customized learning method and system. The AI-based learning method using a web an external server and a terminal and a network for education related to an embodiment of the present invention includes: a first step in which an education server communicates with the web the external server and the terminal based on a responsive web interface and communicates with the external server using a learner profile interface and a learning tool interoperability (LTI) service; and a second step in which the education server provides learning contents to a user using a learning analysis component an AI processing component a content processing component and a service processing component. The learning content may include a question bank and knowledge map-based contents customized automatic question creation contents social learning and e-portfolio-based contents and learning analysis and artificial intelligence-based contents. COPYRIGHT KIPO 2022";2021
"The present invention relates to a method for automatically providing feedback learning content using math problem solving which enables a user to perform self-directed learning. According to the present invention when a user searches for and solves a math problem takes a photo of a solution with a smart device and registers the photo on a platform server a knowledge sharing server platform connected to a network environment or a wireless environment an optical character recognition (OCR) technology converts formulas into text by using a Mathpix API and convers languages excluding the formulas into text using by using a Google API; compares a correct answer explanation of the problem stored in a server database with the converted text to find a part that the user answered incorrectly; and allows artificial intelligence to automatically find a chapter and difficulty level of the wrong part to provide the user with learning content of the chapter such as concepts problems and videos thereby enabling the user to perform feedback learning by himself/herself. COPYRIGHT KIPO 2022";2021
"The invention discloses a university enrollment telephone intelligent customer service system. A user module comprises a user registration function a user login function a user questioning function and a user message leaving function. A background customer service management module comprises a background customer service login function an information reply function a user information viewing function a keyword adding function and a reply language function; theuniversity enrollment telephone intelligent customer service system is used for providing telephone traffic efficiency for college enrollment offices combines soft exchange with artificial intelligence to form the telephone robot customer service system can configure a shunting scheme selects manual seat responses or dialogue robot responses is provided with a professional knowledge base can efficiently and accurately answer related questions of colleges counts the received questions answers are manually supplemented at regular intervals generates corpora  and continuously train the dialogue robot so that the response capability of the dialogue robot is improved the problem that the same or similar questions are repeatedly answered by manual response can be avoided the human input is greatly reduced and the telephone traffic efficiency is improved.";2021
"The embodiment of the invention discloses an auxiliary teaching method device and equipment based on a knowledge graph and a storage medium relates to the field of artificial intelligence and canbe applied to a smart education scene thereby promoting the construction of a smart city. The method comprises the steps of extracting keywords and knowledge points from a pre-stored knowledge base to construct a knowledge graph; if the wrong question text sent by the terminal is received extracting a keyword to be queried from the wrong question text; and obtaining knowledge points associated with the to-be-queried keyword from the knowledge graph to form a knowledge point set and sending the knowledge point set to a terminal. By constructing the knowledge graph after the to-be-queried keyword extracted from the wrong question text is obtained the associated knowledge points can be searched from the knowledge graph to form the knowledge point set so that weak knowledge points of students can be quickly and accurately counted for teachers and the teachers can quickly know the learning conditions of the students; therefore a teaching plan can be made more accurately.";2021
"The invention discloses a knowledge map construction method and a storage medium. The method comprises the following steps that knowledge points are recognized corpora which are partially labeled manually are input into a CRF algorithm model based on machine learning to be trained and the CRF algorithm model is preset as part-of-speech feature tendency and/or information entropy feature tendency and/or full-text word frequency tendency and/or inverse document probability tendency; And knowledge point recognition is performed on the specific document set by using the trained model to obtain a knowledge point set. The knowledge search-oriented dynamic knowledge map construction method provided by the invention is not oriented to the specific business field has universal applicability in different industries only needs to mark a small amount of knowledge points in common and has a good effect of unsupervised operation. And meanwhile for continuously expanded enterprise documentsthe effect of continuously optimizing knowledge map results can also be achieved.";2019
